"...1","Opportunity Name","ID","Opportunity Amount","Currency","Expected Close Date","Sales Stage","Probability (%)","Next Step","Type","Account Name","Description","Amount","Lead Source","campaign_id","Assigned to","Assigned User","Date Created","Date Modified","Created By","Modified By","Deleted","Geocode Status","Longitude","Address","Latitude"
NA,"Cursus A PC vtHMAAY  MOL Standard Services","006i0000001vtHMAAY",1,NA,NA,"Closed Lost",NA,NA,"Services",NA,NA,504,NA,NA,NA,NA,NA,NA,NA,NA,NA,NA,-70.92284,NA,42.249448
NA,"Cursus A PC vv0yAAA  MOL Standard Services","006i0000001vv0yAAA",39,NA,NA,"Closed Won",NA,NA,"Services",NA,NA,26208,NA,NA,NA,NA,NA,NA,NA,NA,NA,NA,-70.92284,NA,42.249448
NA,"Cursus A PC vvN2AAI  MOL Standard Software","006i0000001vvN2AAI",65,NA,NA,"Closed Lost",NA,NA,"Software",NA,NA,50960,NA,NA,NA,NA,NA,NA,NA,NA,NA,NA,-70.92284,NA,42.249448
NA,"Cursus A PC vxBUAAY  MOL Standard Software","006i0000001vxBUAAY",13,NA,NA,"Closed Won",NA,NA,"Software",NA,NA,10400,NA,NA,NA,NA,NA,NA,NA,NA,NA,NA,-70.92284,NA,42.249448
NA,"Cursus A PC vxJuAAI  MOL Standard Software","006i0000001vxJuAAI",19,NA,NA,"Closed Won",NA,NA,"Software",NA,NA,12160,NA,NA,NA,NA,NA,NA,NA,NA,NA,NA,-70.92284,NA,42.249448
NA,"Sagittis Semper Nam Inc. vxjkAAA  MOL Standard Software","006i0000001vxjkAAA",8,NA,NA,"Closed Won",NA,NA,"Software",NA,NA,6080,NA,NA,NA,NA,NA,NA,NA,NA,NA,NA,-122.369116,NA,47.664878
NA,"Tellus Lorem Eu PC vuGAAAY  MOL Standard Services","006i0000001vuGAAAY",3,NA,NA,"Closed Won",NA,NA,"Services",NA,NA,1827,NA,NA,NA,NA,NA,NA,NA,NA,NA,NA,-87.564,NA,37.981589
NA,"Tellus Lorem Eu PC vuGBAAY  MOL Standard Software","006i0000001vuGBAAY",21,NA,NA,"Closed Won",NA,NA,"Software",NA,NA,12096,NA,NA,NA,NA,NA,NA,NA,NA,NA,NA,-87.564,NA,37.981589
NA,"Tellus Lorem Eu PC vvTvAAI  MOL Standard Software","006i0000001vvTvAAI",11,NA,NA,"Closed Won",NA,NA,"Software",NA,NA,6600,NA,NA,NA,NA,NA,NA,NA,NA,NA,NA,-87.564,NA,37.981589
NA,"Tellus Lorem Eu PC vxK7AAI  MOL Standard Software","006i0000001vxK7AAI",4,NA,NA,"Closed Won",NA,NA,"Software",NA,NA,2880,NA,NA,NA,NA,NA,NA,NA,NA,NA,NA,-87.564,NA,37.981589
NA,"Malesuada Fames Limited vx9sAAA  MOL Standard Services","006i0000001vx9sAAA",2,NA,NA,"Closed Lost",NA,NA,"Services",NA,NA,1372,NA,NA,NA,NA,NA,NA,NA,NA,NA,NA,-121.293479,NA,44.088694
NA,"Malesuada Fames Limited vxH4AAI  MOL Mobile Software","006i0000001vxH4AAI",6,NA,NA,"Closed Lost",NA,NA,"Software",NA,NA,5022,NA,NA,NA,NA,NA,NA,NA,NA,NA,NA,-121.293479,NA,44.088694
NA,"Malesuada Fames Limited vx85AAA  MOL Standard Maintenance","006i0000001vx85AAA",4,NA,NA,"Closed Won",NA,NA,"Maintenance",NA,NA,384,NA,NA,NA,NA,NA,NA,NA,NA,NA,NA,-121.293479,NA,44.088694
NA,"Malesuada Fames Limited vxT2AAI  MOL Standard Software","006i0000001vxT2AAI",17,NA,NA,"Closed Won",NA,NA,"Software",NA,NA,11560,NA,NA,NA,NA,NA,NA,NA,NA,NA,NA,-121.293479,NA,44.088694
NA,"Malesuada Fames Limited vxjvAAA  MOL Mobile Software","006i0000001vxjvAAA",43,NA,NA,"Closed Won",NA,NA,"Software",NA,NA,28251,NA,NA,NA,NA,NA,NA,NA,NA,NA,NA,-121.293479,NA,44.088694
NA,"Dot Technology vwzNAAQ  MOL Mobile Software","006i0000001vwzNAAQ",44,NA,NA,"Closed Lost",NA,NA,"Software",NA,NA,28512,NA,NA,NA,NA,NA,NA,NA,NA,NA,NA,-121.305232,NA,44.075816
NA,"Dot Technology vxK9AAI  MOL Mobile Software","006i0000001vxK9AAI",31,NA,NA,"Closed Lost",NA,NA,"Software",NA,NA,20925,NA,NA,NA,NA,NA,NA,NA,NA,NA,NA,-121.305232,NA,44.075816
NA,"Dui Suspendisse Institute vvkWAAQ  MOL Premium Software","006i0000001vvkWAAQ",11,NA,NA,"Closed Won",NA,NA,"Software",NA,NA,13068,NA,NA,NA,NA,NA,NA,NA,NA,NA,NA,-106.600323,NA,35.138895
NA,"Dui Suspendisse Institute vvtvAAA  MOL Standard Software","006i0000001vvtvAAA",3,NA,NA,"Closed Won",NA,NA,"Software",NA,NA,1704,NA,NA,NA,NA,NA,NA,NA,NA,NA,NA,-106.600323,NA,35.138895
NA,"Dui Suspendisse Institute vwb8AAA  MOL Standard Services","006i0000001vwb8AAA",1,NA,NA,"Closed Won",NA,NA,"Services",NA,NA,679,NA,NA,NA,NA,NA,NA,NA,NA,NA,NA,-106.600323,NA,35.138895
NA,"Dui Suspendisse Institute vxedAAA  MOL Standard Software","006i0000001vxedAAA",34,NA,NA,"Closed Lost",NA,NA,"Software",NA,NA,22848,NA,NA,NA,NA,NA,NA,NA,NA,NA,NA,-106.600323,NA,35.138895
NA,"Dui Suspendisse Institute vxjYAAQ  MOL Standard Software","006i0000001vxjYAAQ",3,NA,NA,"Closed Lost",NA,NA,"Software",NA,NA,1992,NA,NA,NA,NA,NA,NA,NA,NA,NA,NA,-106.600323,NA,35.138895
NA,"Non LLC vxKFAAY  MOL Premium Software","006i0000001vxKFAAY",26,NA,NA,"Closed Won",NA,NA,"Software",NA,NA,25272,NA,NA,NA,NA,NA,NA,NA,NA,NA,NA,-123.26097,NA,44.561253
NA,"Ut Lacus Institute vtjaAAA  MOL Standard Software","006i0000001vtjaAAA",7,NA,NA,"Closed Won",NA,NA,"Software",NA,NA,4816,NA,NA,NA,NA,NA,NA,NA,NA,NA,NA,-82.588865,NA,35.578984
NA,"Ut Lacus Institute vuhxAAA  MOL Standard Software","006i0000001vuhxAAA",15,NA,NA,"Closed Won",NA,NA,"Software",NA,NA,10920,NA,NA,NA,NA,NA,NA,NA,NA,NA,NA,-82.588865,NA,35.578984
NA,"Ut Lacus Institute vuwWAAQ  MOL Standard Services","006i0000001vuwWAAQ",1,NA,NA,"Closed Lost",NA,NA,"Services",NA,NA,686,NA,NA,NA,NA,NA,NA,NA,NA,NA,NA,-82.588865,NA,35.578984
NA,"Ut Lacus Institute vvU6AAI  MOL Standard Software","006i0000001vvU6AAI",54,NA,NA,"Closed Lost",NA,NA,"Software",NA,NA,33696,NA,NA,NA,NA,NA,NA,NA,NA,NA,NA,-82.588865,NA,35.578984
NA,"Ut Lacus Institute vvjuAAA  MOL Standard Maintenance","006i0000001vvjuAAA",8,NA,NA,"Closed Won",NA,NA,"Maintenance",NA,NA,748.8,NA,NA,NA,NA,NA,NA,NA,NA,NA,NA,-82.588865,NA,35.578984
NA,"Ut Lacus Institute vwBrAAI  MOL Mobile Services","006i0000001vwBrAAI",20,NA,NA,"Closed Won",NA,NA,"Services",NA,NA,11520,NA,NA,NA,NA,NA,NA,NA,NA,NA,NA,-82.588865,NA,35.578984
NA,"Ut Lacus Institute vwBrAAIX  MOL Mobile Services","006i0000001vwBrAAIX",30,NA,NA,"Closed Won",NA,NA,"Services",NA,NA,17280,NA,NA,NA,NA,NA,NA,NA,NA,NA,NA,-82.588865,NA,35.578984
NA,"Ut Lacus Institute vwBrAAIY  MOL Mobile Services","006i0000001vwBrAAIY",45,NA,NA,"Closed Won",NA,NA,"Services",NA,NA,25920,NA,NA,NA,NA,NA,NA,NA,NA,NA,NA,-82.588865,NA,35.578984
NA,"Ut Lacus Institute vwBrAAIZ  MOL Mobile Services","006i0000001vwBrAAIZ",80,NA,NA,"Closed Won",NA,NA,"Services",NA,NA,46080,NA,NA,NA,NA,NA,NA,NA,NA,NA,NA,-82.588865,NA,35.578984
NA,"Ut Lacus Institute vwaWAAQ  MOL Standard Software","006i0000001vwaWAAQ",23,NA,NA,"Closed Won",NA,NA,"Software",NA,NA,13248,NA,NA,NA,NA,NA,NA,NA,NA,NA,NA,-82.588865,NA,35.578984
NA,"Ut Lacus Institute vwp9AAA  MOL Standard Services","006i0000001vwp9AAA",2,NA,NA,"Closed Won",NA,NA,"Services",NA,NA,1064,NA,NA,NA,NA,NA,NA,NA,NA,NA,NA,-82.588865,NA,35.578984
NA,"Ut Lacus Institute vxMBAAY  MOL Standard Software","006i0000001vxMBAAY",23,NA,NA,"Closed Won",NA,NA,"Software",NA,NA,13064,NA,NA,NA,NA,NA,NA,NA,NA,NA,NA,-82.588865,NA,35.578984
NA,"Ut Lacus Institute vwBrAAIO  MOL Mobile Services","006i0000001vwBrAAIO",100,NA,NA,"Closed Won",NA,NA,"Services",NA,NA,57600,NA,NA,NA,NA,NA,NA,NA,NA,NA,NA,-82.588865,NA,35.578984
NA,"Ut Lacus Institute vxk4AAA  MOL Standard Software","006i0000001vxk4AAA",16,NA,NA,"Closed Lost",NA,NA,"Software",NA,NA,11904,NA,NA,NA,NA,NA,NA,NA,NA,NA,NA,-82.588865,NA,35.578984
NA,"Magna Incorporated vxjeAAA  MOL Standard Software","006i0000001vxjeAAA",18,NA,NA,"Closed Lost",NA,NA,"Software",NA,NA,11952,NA,NA,NA,NA,NA,NA,NA,NA,NA,NA,-122.367549,NA,47.664583
NA,"Sapien Cursus PC vta6AAA  MOL Standard Software","006i0000001vta6AAA",2,NA,NA,"Closed Lost",NA,NA,"Software",NA,NA,1168,NA,NA,NA,NA,NA,NA,NA,NA,NA,NA,-75.778101,NA,40.5162
NA,"Sapien Cursus PC vuJEAAY  MOL Standard Software","006i0000001vuJEAAY",66,NA,NA,"Closed Won",NA,NA,"Software",NA,NA,51744,NA,NA,NA,NA,NA,NA,NA,NA,NA,NA,-75.778101,NA,40.5162
NA,"Sapien Cursus PC vxhXAAQ  MOL Standard Software","006i0000001vxhXAAQ",11,NA,NA,"Closed Lost",NA,NA,"Software",NA,NA,8096,NA,NA,NA,NA,NA,NA,NA,NA,NA,NA,-75.778101,NA,40.5162
NA,"Sapien Cursus PC vxk8AAA  MOL Standard Maintenance","006i0000001vxk8AAA",11,NA,NA,"Closed Won",NA,NA,"Maintenance",NA,NA,1227.6,NA,NA,NA,NA,NA,NA,NA,NA,NA,NA,-75.778101,NA,40.5162
NA,"Nulla LLP vtSvAAI  MOL Standard Services","006i0000001vtSvAAI",1,NA,NA,"Closed Lost",NA,NA,"Services",NA,NA,574,NA,NA,NA,NA,NA,NA,NA,NA,NA,NA,-77.078679,NA,41.807594
NA,"Nulla LLP vxKMAAY  MOL Standard Software","006i0000001vxKMAAY",12,NA,NA,"Closed Won",NA,NA,"Software",NA,NA,6912,NA,NA,NA,NA,NA,NA,NA,NA,NA,NA,-77.078679,NA,41.807594
NA,"Pulvinar Arcu Ltd vtbWAAQ  MOL Standard Services","006i0000001vtbWAAQ",86,NA,NA,"Closed Won",NA,NA,"Services",NA,NA,50568,NA,NA,NA,NA,NA,NA,NA,NA,NA,NA,-75.661351,NA,39.635053
NA,"Pulvinar Arcu Ltd vtobAAA  MOL Standard Software","006i0000001vtobAAA",11,NA,NA,"Closed Won",NA,NA,"Software",NA,NA,6864,NA,NA,NA,NA,NA,NA,NA,NA,NA,NA,-75.661351,NA,39.635053
NA,"Pulvinar Arcu Ltd vuLQAAY  MOL Standard Software","006i0000001vuLQAAY",4,NA,NA,"Closed Won",NA,NA,"Software",NA,NA,2432,NA,NA,NA,NA,NA,NA,NA,NA,NA,NA,-75.661351,NA,39.635053
NA,"Pulvinar Arcu Ltd vudzAAA  MOL Standard Software","006i0000001vudzAAA",5,NA,NA,"Closed Won",NA,NA,"Software",NA,NA,2840,NA,NA,NA,NA,NA,NA,NA,NA,NA,NA,-75.661351,NA,39.635053
NA,"Pulvinar Arcu Ltd vuofAAA  MOL Standard Software","006i0000001vuofAAA",970,NA,NA,"Closed Won",NA,NA,"Software",NA,NA,605280,NA,NA,NA,NA,NA,NA,NA,NA,NA,NA,-75.661351,NA,39.635053
NA,"Pulvinar Arcu Ltd vvSnAAI  MOL Mobile Software","006i0000001vvSnAAI",39,NA,NA,"Closed Won",NA,NA,"Software",NA,NA,32994,NA,NA,NA,NA,NA,NA,NA,NA,NA,NA,-75.661351,NA,39.635053
NA,"Pulvinar Arcu Ltd vvx0AAA  MOL Standard Software","006i0000001vvx0AAA",12,NA,NA,"Closed Won",NA,NA,"Software",NA,NA,7104,NA,NA,NA,NA,NA,NA,NA,NA,NA,NA,-75.661351,NA,39.635053
NA,"Pulvinar Arcu Ltd vvwzAAA  MOL Premium Maintenance","006i0000001vvwzAAA",16,NA,NA,"Closed Won",NA,NA,"Maintenance",NA,NA,2232,NA,NA,NA,NA,NA,NA,NA,NA,NA,NA,-75.661351,NA,39.635053
NA,"Pulvinar Arcu Ltd vwSiAAI  MOL Standard Maintenance","006i0000001vwSiAAI",43,NA,NA,"Closed Won",NA,NA,"Maintenance",NA,NA,4231.2,NA,NA,NA,NA,NA,NA,NA,NA,NA,NA,-75.661351,NA,39.635053
NA,"Pulvinar Arcu Ltd vxbRAAQ  MOL Standard Software","006i0000001vxbRAAQ",154,NA,NA,"Closed Won",NA,NA,"Software",NA,NA,104720,NA,NA,NA,NA,NA,NA,NA,NA,NA,NA,-75.661351,NA,39.635053
NA,"Pulvinar Arcu Ltd vxkBAAQ  MOL Standard Maintenance","006i0000001vxkBAAQ",15,NA,NA,"Closed Won",NA,NA,"Maintenance",NA,NA,1620,NA,NA,NA,NA,NA,NA,NA,NA,NA,NA,-75.661351,NA,39.635053
NA,"Dignissim Magna Ltd vtwmAAA  MOL Standard Services","006i0000001vtwmAAA",2,NA,NA,"Closed Won",NA,NA,"Services",NA,NA,1036,NA,NA,NA,NA,NA,NA,NA,NA,NA,NA,-85.833737,NA,33.66028
NA,"Dignissim Magna Ltd vu9QAAQ  MOL Standard Software","006i0000001vu9QAAQ",13,NA,NA,"Closed Won",NA,NA,"Software",NA,NA,10192,NA,NA,NA,NA,NA,NA,NA,NA,NA,NA,-85.833737,NA,33.66028
NA,"Dignissim Magna Ltd vuApAAI  MOL Standard Maintenance","006i0000001vuApAAI",7,NA,NA,"Closed Won",NA,NA,"Maintenance",NA,NA,831.6,NA,NA,NA,NA,NA,NA,NA,NA,NA,NA,-85.833737,NA,33.66028
NA,"Dignissim Magna Ltd vuAyAAI  MOL Standard Software","006i0000001vuAyAAI",7,NA,NA,"Closed Won",NA,NA,"Software",NA,NA,5488,NA,NA,NA,NA,NA,NA,NA,NA,NA,NA,-85.833737,NA,33.66028
NA,"Dignissim Magna Ltd vuG6AAI  MOL Standard Maintenance","006i0000001vuG6AAI",70,NA,NA,"Closed Won",NA,NA,"Maintenance",NA,NA,6972,NA,NA,NA,NA,NA,NA,NA,NA,NA,NA,-85.833737,NA,33.66028
NA,"Dignissim Magna Ltd vujOAAQ  MOL Standard Services","006i0000001vujOAAQ",144,NA,NA,"Closed Lost",NA,NA,"Services",NA,NA,79632,NA,NA,NA,NA,NA,NA,NA,NA,NA,NA,-85.833737,NA,33.66028
NA,"Dignissim Magna Ltd vvEYAAY  MOL Standard Maintenance","006i0000001vvEYAAY",3,NA,NA,"Closed Won",NA,NA,"Maintenance",NA,NA,327.6,NA,NA,NA,NA,NA,NA,NA,NA,NA,NA,-85.833737,NA,33.66028
NA,"Dignissim Magna Ltd vvGKAAY  MOL Standard Software","006i0000001vvGKAAY",40,NA,NA,"Closed Won",NA,NA,"Software",NA,NA,25920,NA,NA,NA,NA,NA,NA,NA,NA,NA,NA,-85.833737,NA,33.66028
NA,"Dignissim Magna Ltd vvGLAAY  MOL Standard Software","006i0000001vvGLAAY",4,NA,NA,"Closed Won",NA,NA,"Software",NA,NA,2336,NA,NA,NA,NA,NA,NA,NA,NA,NA,NA,-85.833737,NA,33.66028
NA,"Dignissim Magna Ltd vvMMAAY  MOL Standard Services","006i0000001vvMMAAY",10,NA,NA,"Closed Won",NA,NA,"Services",NA,NA,5740,NA,NA,NA,NA,NA,NA,NA,NA,NA,NA,-85.833737,NA,33.66028
NA,"Dignissim Magna Ltd vvZ1AAI  MOL Standard Software","006i0000001vvZ1AAI",1,NA,NA,"Closed Lost",NA,NA,"Software",NA,NA,696,NA,NA,NA,NA,NA,NA,NA,NA,NA,NA,-85.833737,NA,33.66028
NA,"Dignissim Magna Ltd vvcdAAA  MOL Standard Software","006i0000001vvcdAAA",5,NA,NA,"Closed Won",NA,NA,"Software",NA,NA,3560,NA,NA,NA,NA,NA,NA,NA,NA,NA,NA,-85.833737,NA,33.66028
NA,"Dignissim Magna Ltd vvk3AAA  MOL Premium Maintenance","006i0000001vvk3AAA",21,NA,NA,"Closed Won",NA,NA,"Maintenance",NA,NA,2362.5,NA,NA,NA,NA,NA,NA,NA,NA,NA,NA,-85.833737,NA,33.66028
NA,"Dignissim Magna Ltd vw2KAAQ  MOL Standard Services","006i0000001vw2KAAQ",13,NA,NA,"Closed Won",NA,NA,"Services",NA,NA,7826,NA,NA,NA,NA,NA,NA,NA,NA,NA,NA,-85.833737,NA,33.66028
NA,"Dignissim Magna Ltd vwJSAAY  MOL Standard Software","006i0000001vwJSAAY",14,NA,NA,"Closed Won",NA,NA,"Software",NA,NA,10640,NA,NA,NA,NA,NA,NA,NA,NA,NA,NA,-85.833737,NA,33.66028
NA,"Dignissim Magna Ltd vwLEAAY  MOL Standard Software","006i0000001vwLEAAY",491,NA,NA,"Closed Won",NA,NA,"Software",NA,NA,345664,NA,NA,NA,NA,NA,NA,NA,NA,NA,NA,-85.833737,NA,33.66028
NA,"Dignissim Magna Ltd vwKHAAY  MOL Standard Software","006i0000001vwKHAAY",3,NA,NA,"Closed Lost",NA,NA,"Software",NA,NA,2280,NA,NA,NA,NA,NA,NA,NA,NA,NA,NA,-85.833737,NA,33.66028
NA,"Dignissim Magna Ltd vwkMAAQ  MOL Mobile Maintenance","006i0000001vwkMAAQ",2,NA,NA,"Closed Lost",NA,NA,"Maintenance",NA,NA,213.6,NA,NA,NA,NA,NA,NA,NA,NA,NA,NA,-85.833737,NA,33.66028
NA,"Dignissim Magna Ltd vwnKAAQ  MOL Standard Services","006i0000001vwnKAAQ",18,NA,NA,"Closed Won",NA,NA,"Services",NA,NA,10206,NA,NA,NA,NA,NA,NA,NA,NA,NA,NA,-85.833737,NA,33.66028
NA,"Dignissim Magna Ltd vxAmAAI  MOL Standard Software","006i0000001vxAmAAI",12,NA,NA,"Closed Won",NA,NA,"Software",NA,NA,7104,NA,NA,NA,NA,NA,NA,NA,NA,NA,NA,-85.833737,NA,33.66028
NA,"Dignissim Magna Ltd vxB3AAI  MOL Standard Maintenance","006i0000001vxB3AAI",4,NA,NA,"Closed Lost",NA,NA,"Maintenance",NA,NA,393.6,NA,NA,NA,NA,NA,NA,NA,NA,NA,NA,-85.833737,NA,33.66028
NA,"Dignissim Magna Ltd vxMNAAY  MOL Standard Software","006i0000001vxMNAAY",708,NA,NA,"Closed Lost",NA,NA,"Software",NA,NA,492768,NA,NA,NA,NA,NA,NA,NA,NA,NA,NA,-85.833737,NA,33.66028
NA,"Dignissim Magna Ltd vxRQAAY  MOL Standard Software","006i0000001vxRQAAY",171,NA,NA,"Closed Won",NA,NA,"Software",NA,NA,131328,NA,NA,NA,NA,NA,NA,NA,NA,NA,NA,-85.833737,NA,33.66028
NA,"Dignissim Magna Ltd vxXMAAY  MOL Standard Services","006i0000001vxXMAAY",30,NA,NA,"Closed Won",NA,NA,"Services",NA,NA,20790,NA,NA,NA,NA,NA,NA,NA,NA,NA,NA,-85.833737,NA,33.66028
NA,"Dignissim Magna Ltd vxkDAAQ  MOL Standard Services","006i0000001vxkDAAQ",48,NA,NA,"Closed Won",NA,NA,"Services",NA,NA,24864,NA,NA,NA,NA,NA,NA,NA,NA,NA,NA,-85.833737,NA,33.66028
NA,"Neque Sed Inc. vvfAAAQ  MOL Premium Software","006i0000001vvfAAAQ",107,NA,NA,"Closed Lost",NA,NA,"Software",NA,NA,91164,NA,NA,NA,NA,NA,NA,NA,NA,NA,NA,-112.068723,NA,33.509527
NA,"Neque Sed Inc. vvkTAAQ  MOL Standard Services","006i0000001vvkTAAQ",22,NA,NA,"Closed Lost",NA,NA,"Services",NA,NA,12012,NA,NA,NA,NA,NA,NA,NA,NA,NA,NA,-112.068723,NA,33.509527
NA,"Neque Sed Inc. vvkUAAQ  MOL Mobile Software","006i0000001vvkUAAQ",20,NA,NA,"Closed Won",NA,NA,"Software",NA,NA,13860,NA,NA,NA,NA,NA,NA,NA,NA,NA,NA,-112.068723,NA,33.509527
NA,"Neque Sed Inc. vxWsAAI  MOL Mobile Maintenance","006i0000001vxWsAAI",111,NA,NA,"Closed Lost",NA,NA,"Maintenance",NA,NA,11988,NA,NA,NA,NA,NA,NA,NA,NA,NA,NA,-112.068723,NA,33.509527
NA,"Neque Sed Inc. vxjVAAQ  MOL Standard Maintenance","006i0000001vxjVAAQ",13,NA,NA,"Closed Won",NA,NA,"Maintenance",NA,NA,1326,NA,NA,NA,NA,NA,NA,NA,NA,NA,NA,-112.068723,NA,33.509527
NA,"Neque Sed Inc. vxkPAAQ  MOL Premium Software","006i0000001vxkPAAQ",3,NA,NA,"Closed Won",NA,NA,"Software",NA,NA,3060,NA,NA,NA,NA,NA,NA,NA,NA,NA,NA,-112.068723,NA,33.509527
NA,"Neque Sed Inc. vxkQAAQ  MOL Premium Software","006i0000001vxkQAAQ",3,NA,NA,"Closed Lost",NA,NA,"Software",NA,NA,3168,NA,NA,NA,NA,NA,NA,NA,NA,NA,NA,-112.068723,NA,33.509527
NA,"Suspendisse Limited vuFoAAI  MOL Standard Services","006i0000001vuFoAAI",44,NA,NA,"Closed Won",NA,NA,"Services",NA,NA,22484,NA,NA,NA,NA,NA,NA,NA,NA,NA,NA,-86.533049,NA,39.167352
NA,"Suspendisse Limited vviGAAQ  MOL Standard Software","006i0000001vviGAAQ",9,NA,NA,"Closed Won",NA,NA,"Software",NA,NA,5112,NA,NA,NA,NA,NA,NA,NA,NA,NA,NA,-86.533049,NA,39.167352
NA,"Suspendisse Limited vxL5AAI  MOL Standard Services","006i0000001vxL5AAI",12,NA,NA,"Closed Won",NA,NA,"Services",NA,NA,7896,NA,NA,NA,NA,NA,NA,NA,NA,NA,NA,-86.533049,NA,39.167352
NA,"A Dui Inc. vwNvAAI  MOL Standard Software","006i0000001vwNvAAI",135,NA,NA,"Closed Lost",NA,NA,"Software",NA,NA,88560,NA,NA,NA,NA,NA,NA,NA,NA,NA,NA,-119.660271,NA,37.333159
NA,"A Dui Inc. vwmrAAA  MOL Standard Services","006i0000001vwmrAAA",20,NA,NA,"Closed Won",NA,NA,"Services",NA,NA,13160,NA,NA,NA,NA,NA,NA,NA,NA,NA,NA,-119.660271,NA,37.333159
NA,"A Dui Inc. vx80AAA  MOL Standard Software","006i0000001vx80AAA",26,NA,NA,"Closed Won",NA,NA,"Software",NA,NA,20592,NA,NA,NA,NA,NA,NA,NA,NA,NA,NA,-119.660271,NA,37.333159
NA,"A Dui Inc. vx81AAA  MOL Standard Software","006i0000001vx81AAA",17,NA,NA,"Closed Won",NA,NA,"Software",NA,NA,11424,NA,NA,NA,NA,NA,NA,NA,NA,NA,NA,-119.660271,NA,37.333159
NA,"A Dui Inc. vxfiAAA  MOL Standard Services","006i0000001vxfiAAA",3,NA,NA,"Closed Won",NA,NA,"Services",NA,NA,1995,NA,NA,NA,NA,NA,NA,NA,NA,NA,NA,-119.660271,NA,37.333159
NA,"A Dui Inc. vxkvAAA  MOL Standard Software","006i0000001vxkvAAA",112,NA,NA,"Closed Won",NA,NA,"Software",NA,NA,84224,NA,NA,NA,NA,NA,NA,NA,NA,NA,NA,-119.660271,NA,37.333159
NA,"Ac Turpis Egestas Limited vtA6AAI  MOL Standard Services","006i0000001vtA6AAI",10,NA,NA,"Closed Won",NA,NA,"Services",NA,NA,5600,NA,NA,NA,NA,NA,NA,NA,NA,NA,NA,-114.472287,NA,42.55571
NA,"Ac Turpis Egestas Limited vtZuAAI  MOL Standard Software","006i0000001vtZuAAI",9,NA,NA,"Closed Lost",NA,NA,"Software",NA,NA,6480,NA,NA,NA,NA,NA,NA,NA,NA,NA,NA,-114.472287,NA,42.55571
NA,"Ac Turpis Egestas Limited vth5AAA  MOL Standard Software","006i0000001vth5AAA",25,NA,NA,"Closed Won",NA,NA,"Software",NA,NA,19000,NA,NA,NA,NA,NA,NA,NA,NA,NA,NA,-114.472287,NA,42.55571
NA,"Ac Turpis Egestas Limited vth6AAA  MOL Standard Software","006i0000001vth6AAA",3,NA,NA,"Closed Won",NA,NA,"Software",NA,NA,2040,NA,NA,NA,NA,NA,NA,NA,NA,NA,NA,-114.472287,NA,42.55571
NA,"Ac Turpis Egestas Limited vtl5AAA  MOL Standard Software","006i0000001vtl5AAA",1,NA,NA,"Closed Lost",NA,NA,"Software",NA,NA,704,NA,NA,NA,NA,NA,NA,NA,NA,NA,NA,-114.472287,NA,42.55571
NA,"Ac Turpis Egestas Limited vtnlAAA  MOL Standard Software","006i0000001vtnlAAA",11,NA,NA,"Closed Won",NA,NA,"Software",NA,NA,7920,NA,NA,NA,NA,NA,NA,NA,NA,NA,NA,-114.472287,NA,42.55571
NA,"Ac Turpis Egestas Limited vtoFAAQ  MOL Standard Services","006i0000001vtoFAAQ",2,NA,NA,"Closed Won",NA,NA,"Maintenance",NA,NA,201.6,NA,NA,NA,NA,NA,NA,NA,NA,NA,NA,-114.472287,NA,42.55571
NA,"Ac Turpis Egestas Limited vtrWAAQ  MOL Standard Software","006i0000001vtrWAAQ",53,NA,NA,"Closed Won",NA,NA,"Software",NA,NA,41128,NA,NA,NA,NA,NA,NA,NA,NA,NA,NA,-114.472287,NA,42.55571
NA,"Ac Turpis Egestas Limited vttmAAA  MOL Standard Software","006i0000001vttmAAA",13,NA,NA,"Closed Won",NA,NA,"Software",NA,NA,9672,NA,NA,NA,NA,NA,NA,NA,NA,NA,NA,-114.472287,NA,42.55571
NA,"Ac Turpis Egestas Limited vtyCAAQ  MOL Premium Software","006i0000001vtyCAAQ",208,NA,NA,"Closed Lost",NA,NA,"Software",NA,NA,199680,NA,NA,NA,NA,NA,NA,NA,NA,NA,NA,-114.472287,NA,42.55571
NA,"Ac Turpis Egestas Limited vtzGAAQ  MOL Standard Software","006i0000001vtzGAAQ",9,NA,NA,"Closed Won",NA,NA,"Software",NA,NA,6120,NA,NA,NA,NA,NA,NA,NA,NA,NA,NA,-114.472287,NA,42.55571
NA,"Ac Turpis Egestas Limited vu0fAAA  MOL Standard Software","006i0000001vu0fAAA",17,NA,NA,"Closed Won",NA,NA,"Maintenance",NA,NA,1897.2,NA,NA,NA,NA,NA,NA,NA,NA,NA,NA,-114.472287,NA,42.55571
NA,"Ac Turpis Egestas Limited vu3HAAQ  MOL Standard Maintenance","006i0000001vu3HAAQ",2,NA,NA,"Closed Lost",NA,NA,"Maintenance",NA,NA,192,NA,NA,NA,NA,NA,NA,NA,NA,NA,NA,-114.472287,NA,42.55571
NA,"Ac Turpis Egestas Limited vu3qAAA  MOL Standard Software","006i0000001vu3qAAA",14,NA,NA,"Closed Won",NA,NA,"Software",NA,NA,10752,NA,NA,NA,NA,NA,NA,NA,NA,NA,NA,-114.472287,NA,42.55571
NA,"Ac Turpis Egestas Limited vu3rAAA  MOL Standard Software","006i0000001vu3rAAA",18,NA,NA,"Closed Lost",NA,NA,"Software",NA,NA,13968,NA,NA,NA,NA,NA,NA,NA,NA,NA,NA,-114.472287,NA,42.55571
NA,"Ac Turpis Egestas Limited vu4bAAA  MOL Standard Software","006i0000001vu4bAAA",2,NA,NA,"Closed Won",NA,NA,"Software",NA,NA,1456,NA,NA,NA,NA,NA,NA,NA,NA,NA,NA,-114.472287,NA,42.55571
NA,"Ac Turpis Egestas Limited vu4cAAA  MOL Standard Software","006i0000001vu4cAAA",13,NA,NA,"Closed Lost",NA,NA,"Software",NA,NA,9256,NA,NA,NA,NA,NA,NA,NA,NA,NA,NA,-114.472287,NA,42.55571
NA,"Ac Turpis Egestas Limited vu4dAAA  MOL Standard Software","006i0000001vu4dAAA",17,NA,NA,"Closed Lost",NA,NA,"Software",NA,NA,11016,NA,NA,NA,NA,NA,NA,NA,NA,NA,NA,-114.472287,NA,42.55571
NA,"Ac Turpis Egestas Limited vu7vAAA  MOL Standard Software","006i0000001vu7vAAA",3,NA,NA,"Closed Lost",NA,NA,"Software",NA,NA,1896,NA,NA,NA,NA,NA,NA,NA,NA,NA,NA,-114.472287,NA,42.55571
NA,"Ac Turpis Egestas Limited vu9FAAQ  MOL Standard Maintenance","006i0000001vu9FAAQ",140,NA,NA,"Closed Lost",NA,NA,"Maintenance",NA,NA,14448,NA,NA,NA,NA,NA,NA,NA,NA,NA,NA,-114.472287,NA,42.55571
NA,"Ac Turpis Egestas Limited vuA1AAI  MOL Standard Maintenance","006i0000001vuA1AAI",13,NA,NA,"Closed Won",NA,NA,"Maintenance",NA,NA,1560,NA,NA,NA,NA,NA,NA,NA,NA,NA,NA,-114.472287,NA,42.55571
NA,"Ac Turpis Egestas Limited vuBGAAY  MOL Standard Services","006i0000001vuBGAAY",22,NA,NA,"Closed Won",NA,NA,"Services",NA,NA,11242,NA,NA,NA,NA,NA,NA,NA,NA,NA,NA,-114.472287,NA,42.55571
NA,"Ac Turpis Egestas Limited vuBHAAY  MOL Standard Software","006i0000001vuBHAAY",24,NA,NA,"Closed Won",NA,NA,"Software",NA,NA,18624,NA,NA,NA,NA,NA,NA,NA,NA,NA,NA,-114.472287,NA,42.55571
NA,"Ac Turpis Egestas Limited vuBbAAI  MOL Standard Software","006i0000001vuBbAAI",20,NA,NA,"Closed Won",NA,NA,"Software",NA,NA,12000,NA,NA,NA,NA,NA,NA,NA,NA,NA,NA,-114.472287,NA,42.55571
NA,"Ac Turpis Egestas Limited vuBuAAI  MOL Standard Services","006i0000001vuBuAAI",1,NA,NA,"Closed Lost",NA,NA,"Services",NA,NA,630,NA,NA,NA,NA,NA,NA,NA,NA,NA,NA,-114.472287,NA,42.55571
NA,"Ac Turpis Egestas Limited vuEpAAI  MOL Standard Services","006i0000001vuEpAAI",34,NA,NA,"Closed Won",NA,NA,"Services",NA,NA,18564,NA,NA,NA,NA,NA,NA,NA,NA,NA,NA,-114.472287,NA,42.55571
NA,"Ac Turpis Egestas Limited vuEqAAI  MOL Standard Software","006i0000001vuEqAAI",10,NA,NA,"Closed Won",NA,NA,"Software",NA,NA,6640,NA,NA,NA,NA,NA,NA,NA,NA,NA,NA,-114.472287,NA,42.55571
NA,"Ac Turpis Egestas Limited vuGRAAY  MOL Standard Software","006i0000001vuGRAAY",10,NA,NA,"Closed Won",NA,NA,"Software",NA,NA,10080,NA,NA,NA,NA,NA,NA,NA,NA,NA,NA,-114.472287,NA,42.55571
NA,"Ac Turpis Egestas Limited vuJ1AAI  MOL Standard Software","006i0000001vuJ1AAI",12,NA,NA,"Closed Won",NA,NA,"Software",NA,NA,6912,NA,NA,NA,NA,NA,NA,NA,NA,NA,NA,-114.472287,NA,42.55571
NA,"Ac Turpis Egestas Limited vuKcAAI  MOL Mobile Software","006i0000001vuKcAAI",20,NA,NA,"Closed Lost",NA,NA,"Software",NA,NA,13860,NA,NA,NA,NA,NA,NA,NA,NA,NA,NA,-114.472287,NA,42.55571
NA,"Ac Turpis Egestas Limited vuKQAAY  MOL Standard Services","006i0000001vuKQAAY",7,NA,NA,"Closed Lost",NA,NA,"Services",NA,NA,3675,NA,NA,NA,NA,NA,NA,NA,NA,NA,NA,-114.472287,NA,42.55571
NA,"Ac Turpis Egestas Limited vuLvAAI  MOL Standard Software","006i0000001vuLvAAI",12,NA,NA,"Closed Won",NA,NA,"Software",NA,NA,6912,NA,NA,NA,NA,NA,NA,NA,NA,NA,NA,-114.472287,NA,42.55571
NA,"Ac Turpis Egestas Limited vuMIAAY  MOL Standard Software","006i0000001vuMIAAY",51,NA,NA,"Closed Won",NA,NA,"Software",NA,NA,33456,NA,NA,NA,NA,NA,NA,NA,NA,NA,NA,-114.472287,NA,42.55571
NA,"Ac Turpis Egestas Limited vuMlAAI  MOL Standard Software","006i0000001vuMlAAI",25,NA,NA,"Closed Won",NA,NA,"Software",NA,NA,19800,NA,NA,NA,NA,NA,NA,NA,NA,NA,NA,-114.472287,NA,42.55571
NA,"Ac Turpis Egestas Limited vuNpAAI  MOL Standard Maintenance","006i0000001vuNpAAI",11,NA,NA,"Closed Won",NA,NA,"Maintenance",NA,NA,1069.2,NA,NA,NA,NA,NA,NA,NA,NA,NA,NA,-114.472287,NA,42.55571
NA,"Ac Turpis Egestas Limited vuS8AAI  MOL Standard Software","006i0000001vuS8AAI",4,NA,NA,"Closed Lost",NA,NA,"Software",NA,NA,2624,NA,NA,NA,NA,NA,NA,NA,NA,NA,NA,-114.472287,NA,42.55571
NA,"Ac Turpis Egestas Limited vuWHAAY  MOL Standard Software","006i0000001vuWHAAY",8,NA,NA,"Closed Won",NA,NA,"Software",NA,NA,6080,NA,NA,NA,NA,NA,NA,NA,NA,NA,NA,-114.472287,NA,42.55571
NA,"Ac Turpis Egestas Limited vuZGAAY  MOL Standard Software","006i0000001vuZGAAY",60,NA,NA,"Closed Lost",NA,NA,"Software",NA,NA,36960,NA,NA,NA,NA,NA,NA,NA,NA,NA,NA,-114.472287,NA,42.55571
NA,"Ac Turpis Egestas Limited vuYVAAY  MOL Standard Software","006i0000001vuYVAAY",10,NA,NA,"Closed Won",NA,NA,"Maintenance",NA,NA,876,NA,NA,NA,NA,NA,NA,NA,NA,NA,NA,-114.472287,NA,42.55571
NA,"Ac Turpis Egestas Limited vuZFAAY  MOL Standard Software","006i0000001vuZFAAY",1,NA,NA,"Closed Lost",NA,NA,"Software",NA,NA,736,NA,NA,NA,NA,NA,NA,NA,NA,NA,NA,-114.472287,NA,42.55571
NA,"Ac Turpis Egestas Limited vuZEAAY  MOL Standard Software","006i0000001vuZEAAY",1,NA,NA,"Closed Lost",NA,NA,"Software",NA,NA,768,NA,NA,NA,NA,NA,NA,NA,NA,NA,NA,-114.472287,NA,42.55571
NA,"Ac Turpis Egestas Limited vudbAAA  MOL Standard Software","006i0000001vudbAAA",117,NA,NA,"Closed Won",NA,NA,"Software",NA,NA,69264,NA,NA,NA,NA,NA,NA,NA,NA,NA,NA,-114.472287,NA,42.55571
NA,"Ac Turpis Egestas Limited vufNAAQ  MOL Standard Software","006i0000001vufNAAQ",11,NA,NA,"Closed Won",NA,NA,"Software",NA,NA,8360,NA,NA,NA,NA,NA,NA,NA,NA,NA,NA,-114.472287,NA,42.55571
NA,"Ac Turpis Egestas Limited vuiMAAQ  MOL Standard Maintenance","006i0000001vuiMAAQ",1,NA,NA,"Closed Lost",NA,NA,"Maintenance",NA,NA,85.2,NA,NA,NA,NA,NA,NA,NA,NA,NA,NA,-114.472287,NA,42.55571
