"...1","Opportunity Name","ID","Opportunity Amount","Currency","Expected Close Date","Sales Stage","Probability (%)","Next Step","Type","Account Name","Description","Amount","Lead Source","campaign_id","Assigned to","Assigned User","Date Created","Date Modified","Created By","Modified By","Deleted","Geocode Status","Longitude","Address","Latitude"
NA,"Sed Company vxFRAAY  MOL Standard Services","006i0000001vxFRAAY",22,NA,NA,"Closed Won",NA,NA,"Services",NA,NA,11088,NA,NA,NA,NA,NA,NA,NA,NA,NA,NA,-76.86116,NA,40.800867
NA,"Sed Company vxpEAAQ  MOL Standard Maintenance","006i0000001vxpEAAQ",9,NA,NA,"Discover",NA,NA,"Maintenance",NA,NA,950.4,NA,NA,NA,NA,NA,NA,NA,NA,NA,NA,-76.86116,NA,40.800867
NA,"Nec Imperdiet Nec Company vuInAAI  MOL Standard Software","006i0000001vuInAAI",33,NA,NA,"Closed Won",NA,NA,"Software",NA,NA,20592,NA,NA,NA,NA,NA,NA,NA,NA,NA,NA,-83.240214,NA,42.785295
NA,"Nec Imperdiet Nec Company vvXlAAI  MOL Standard Software","006i0000001vvXlAAI",112,NA,NA,"Closed Lost",NA,NA,"Software",NA,NA,68992,NA,NA,NA,NA,NA,NA,NA,NA,NA,NA,-83.240214,NA,42.785295
NA,"Nec Imperdiet Nec Company vwIlAAI  MOL Standard Software","006i0000001vwIlAAI",4,NA,NA,"Closed Lost",NA,NA,"Software",NA,NA,2464,NA,NA,NA,NA,NA,NA,NA,NA,NA,NA,-83.240214,NA,42.785295
NA,"Nec Imperdiet Nec Company vwImAAI  MOL Standard Software","006i0000001vwImAAI",2,NA,NA,"Closed Lost",NA,NA,"Software",NA,NA,1536,NA,NA,NA,NA,NA,NA,NA,NA,NA,NA,-83.240214,NA,42.785295
NA,"Nec Imperdiet Nec Company vwInAAI  MOL Standard Software","006i0000001vwInAAI",13,NA,NA,"Closed Won",NA,NA,"Software",NA,NA,8216,NA,NA,NA,NA,NA,NA,NA,NA,NA,NA,-83.240214,NA,42.785295
NA,"Nec Imperdiet Nec Company vwONAAY  MOL Standard Software","006i0000001vwONAAY",3,NA,NA,"Closed Won",NA,NA,"Services",NA,NA,1278,NA,NA,NA,NA,NA,NA,NA,NA,NA,NA,-83.240214,NA,42.785295
NA,"Nec Imperdiet Nec Company vwiyAAA  MOL Standard Software","006i0000001vwiyAAA",2,NA,NA,"Closed Lost",NA,NA,"Software",NA,NA,1376,NA,NA,NA,NA,NA,NA,NA,NA,NA,NA,-83.240214,NA,42.785295
NA,"Nec Imperdiet Nec Company vxQ1AAI  MOL Standard Software","006i0000001vxQ1AAI",56,NA,NA,"Closed Won",NA,NA,"Software",NA,NA,43456,NA,NA,NA,NA,NA,NA,NA,NA,NA,NA,-83.240214,NA,42.785295
NA,"Varius Industries vvZVAAY  MOL Standard Software","006i0000001vvZVAAY",1,NA,NA,"Closed Lost",NA,NA,"Software",NA,NA,752,NA,NA,NA,NA,NA,NA,NA,NA,NA,NA,-116.097026,NA,44.908986
NA,"Varius Industries vwx2AAA  MOL Standard Software","006i0000001vwx2AAA",28,NA,NA,"Closed Won",NA,NA,"Services",NA,NA,26320,NA,NA,NA,NA,NA,NA,NA,NA,NA,NA,-116.097026,NA,44.908986
NA,"Varius Industries vxZAAAY  MOL Standard Software","006i0000001vxZAAAY",3,NA,NA,"Closed Won",NA,NA,"Software",NA,NA,2088,NA,NA,NA,NA,NA,NA,NA,NA,NA,NA,-116.097026,NA,44.908986
NA,"Varius Industries vy72AAA  MOL Standard Software","006i0000001vy72AAA",65,NA,NA,"Commit",NA,NA,"Software",NA,NA,36920,NA,NA,NA,NA,NA,NA,NA,NA,NA,NA,-116.097026,NA,44.908986
NA,"Erat Etiam Vestibulum Limited vvSJAAY  MOL Standard Software","006i0000001vvSJAAY",21,NA,NA,"Closed Lost",NA,NA,"Software",NA,NA,12432,NA,NA,NA,NA,NA,NA,NA,NA,NA,NA,-121.992672,NA,37.387643
NA,"Erat Etiam Vestibulum Limited vwQgAAI  MOL Standard Software","006i0000001vwQgAAI",5,NA,NA,"Closed Won",NA,NA,"Software",NA,NA,3280,NA,NA,NA,NA,NA,NA,NA,NA,NA,NA,-121.992672,NA,37.387643
NA,"Erat Etiam Vestibulum Limited vxPjAAI  MOL Standard Maintenance","006i0000001vxPjAAI",10,NA,NA,"Closed Won",NA,NA,"Services",NA,NA,5040,NA,NA,NA,NA,NA,NA,NA,NA,NA,NA,-121.992672,NA,37.387643
NA,"Magna Nam Ligula LLC vtXAAAY  MOL Standard Software","006i0000001vtXAAAY",19,NA,NA,"Closed Won",NA,NA,"Software",NA,NA,11856,NA,NA,NA,NA,NA,NA,NA,NA,NA,NA,-76.64196,NA,40.950054
NA,"Magna Nam Ligula LLC vuDQAAY  MOL Standard Services","006i0000001vuDQAAY",2,NA,NA,"Closed Lost",NA,NA,"Services",NA,NA,1106,NA,NA,NA,NA,NA,NA,NA,NA,NA,NA,-76.64196,NA,40.950054
NA,"Magna Nam Ligula LLC vxpQAAQ  MOL Standard Software","006i0000001vxpQAAQ",14,NA,NA,"Closed Won",NA,NA,"Services",NA,NA,10080,NA,NA,NA,NA,NA,NA,NA,NA,NA,NA,-76.64196,NA,40.950054
NA,"Faucibus Orci Inc. vuuVAAQ  MOL Standard Software","006i0000001vuuVAAQ",90,NA,NA,"Closed Lost",NA,NA,"Software",NA,NA,55440,NA,NA,NA,NA,NA,NA,NA,NA,NA,NA,-87.698026,NA,41.923688
NA,"Faucibus Orci Inc. vwTfAAI  MOL Mobile Software","006i0000001vwTfAAI",9,NA,NA,"Closed Won",NA,NA,"Software",NA,NA,7128,NA,NA,NA,NA,NA,NA,NA,NA,NA,NA,-87.698026,NA,41.923688
NA,"Faucibus Orci Inc. vxpmAAA  MOL Standard Software","006i0000001vxpmAAA",154,NA,NA,"Discover",NA,NA,"Software",NA,NA,98560,NA,NA,NA,NA,NA,NA,NA,NA,NA,NA,-87.698026,NA,41.923688
NA,"A Odio LLP vvlVAAQ  MOL Mobile Software","006i0000001vvlVAAQ",17,NA,NA,"Closed Won",NA,NA,"Software",NA,NA,10863,NA,NA,NA,NA,NA,NA,NA,NA,NA,NA,-106.531573,NA,35.12965
NA,"A Odio LLP vvuvAAA  MOL Mobile Software","006i0000001vvuvAAA",28,NA,NA,"Closed Won",NA,NA,"Software",NA,NA,22428,NA,NA,NA,NA,NA,NA,NA,NA,NA,NA,-106.531573,NA,35.12965
NA,"A Odio LLP vxPmAAI  MOL Mobile Software","006i0000001vxPmAAI",4,NA,NA,"Closed Won",NA,NA,"Software",NA,NA,2772,NA,NA,NA,NA,NA,NA,NA,NA,NA,NA,-106.531573,NA,35.12965
NA,"Fusce Foundation vvaIAAQ  MOL Standard Maintenance","006i0000001vvaIAAQ",21,NA,NA,"Closed Won",NA,NA,"Maintenance",NA,NA,2167.2,NA,NA,NA,NA,NA,NA,NA,NA,NA,NA,-112.443284,NA,42.859824
NA,"Fusce Foundation vxU9AAI  MOL Standard Maintenance","006i0000001vxU9AAI",2,NA,NA,"Closed Won",NA,NA,"Maintenance",NA,NA,211.2,NA,NA,NA,NA,NA,NA,NA,NA,NA,NA,-112.443284,NA,42.859824
NA,"Fusce Foundation vxpsAAA  MOL Standard Software","006i0000001vxpsAAA",23,NA,NA,"Decision",NA,NA,"Software",NA,NA,13800,NA,NA,NA,NA,NA,NA,NA,NA,NA,NA,-112.443284,NA,42.859824
NA,"Ipsum Donec Inc. vvoCAAQ  MOL Standard Software","006i0000001vvoCAAQ",3,NA,NA,"Closed Lost",NA,NA,"Software",NA,NA,2040,NA,NA,NA,NA,NA,NA,NA,NA,NA,NA,-106.793442,NA,32.309659
NA,"Ipsum Donec Inc. vxq1AAA  MOL Standard Software","006i0000001vxq1AAA",43,NA,NA,"Commit",NA,NA,"Software",NA,NA,24424,NA,NA,NA,NA,NA,NA,NA,NA,NA,NA,-106.793442,NA,32.309659
NA,"Fermentum Arcu Consulting vxQQAAY  MOL Standard Software","006i0000001vxQQAAY",22,NA,NA,"Closed Won",NA,NA,"Software",NA,NA,12672,NA,NA,NA,NA,NA,NA,NA,NA,NA,NA,-122.903001,NA,42.551907
NA,"Porttitor Interdum LLP vwEZAAY  MOL Mobile Services","006i0000001vwEZAAY",197,NA,NA,"Closed Lost",NA,NA,"Services",NA,NA,105198,NA,NA,NA,NA,NA,NA,NA,NA,NA,NA,-121.615152,NA,39.137314
NA,"Porttitor Interdum LLP vwkZAAQ  MOL Standard Software","006i0000001vwkZAAQ",2,NA,NA,"Closed Lost",NA,NA,"Software",NA,NA,1344,NA,NA,NA,NA,NA,NA,NA,NA,NA,NA,-121.615152,NA,39.137314
NA,"Porttitor Interdum LLP vxLSAAY  MOL Standard Services","006i0000001vxLSAAY",10,NA,NA,"Closed Won",NA,NA,"Services",NA,NA,5880,NA,NA,NA,NA,NA,NA,NA,NA,NA,NA,-121.615152,NA,39.137314
NA,"Porttitor Interdum LLP vxWxAAI  MOL Standard Software","006i0000001vxWxAAI",3,NA,NA,"Closed Won",NA,NA,"Software",NA,NA,2208,NA,NA,NA,NA,NA,NA,NA,NA,NA,NA,-121.615152,NA,39.137314
NA,"Porttitor Interdum LLP vxq8AAA  MOL Standard Maintenance","006i0000001vxq8AAA",1,NA,NA,"Decision",NA,NA,"Maintenance",NA,NA,116.4,NA,NA,NA,NA,NA,NA,NA,NA,NA,NA,-121.615152,NA,39.137314
NA,"Mauris Company vxqbAAA  MOL Standard Services","006i0000001vxqbAAA",2,NA,NA,"Closed Won",NA,NA,"Services",NA,NA,1330,NA,NA,NA,NA,NA,NA,NA,NA,NA,NA,-122.377091,NA,47.663896
NA,"Kumatsu Motors vtRYAAY  MOL Standard Software","006i0000001vtRYAAY",10,NA,NA,"Closed Won",NA,NA,"Software",NA,NA,7680,NA,NA,NA,NA,NA,NA,NA,NA,NA,NA,-76.857953,NA,42.572158
NA,"Kumatsu Motors vtyVAAQ  MOL Standard Maintenance","006i0000001vtyVAAQ",12,NA,NA,"Closed Won",NA,NA,"Maintenance",NA,NA,1036.8,NA,NA,NA,NA,NA,NA,NA,NA,NA,NA,-76.857953,NA,42.572158
NA,"Kumatsu Motors vuyMAAQ  MOL Standard Maintenance","006i0000001vuyMAAQ",1,NA,NA,"Closed Lost",NA,NA,"Maintenance",NA,NA,114,NA,NA,NA,NA,NA,NA,NA,NA,NA,NA,-76.857953,NA,42.572158
NA,"Kumatsu Motors vwZjAAI  MOL Standard Maintenance","006i0000001vwZjAAI",28,NA,NA,"Closed Won",NA,NA,"Maintenance",NA,NA,3192,NA,NA,NA,NA,NA,NA,NA,NA,NA,NA,-76.857953,NA,42.572158
NA,"Kumatsu Motors vxQYAAY  MOL Standard Software","006i0000001vxQYAAY",86,NA,NA,"Closed Lost",NA,NA,"Software",NA,NA,61232,NA,NA,NA,NA,NA,NA,NA,NA,NA,NA,-76.857953,NA,42.572158
NA,"In Faucibus Consulting vth2AAA  MOL Standard Maintenance","006i0000001vth2AAA",2,NA,NA,"Closed Won",NA,NA,"Maintenance",NA,NA,213.6,NA,NA,NA,NA,NA,NA,NA,NA,NA,NA,-81.532968,NA,39.287467
NA,"In Faucibus Consulting vtl7AAA  MOL Standard Software","006i0000001vtl7AAA",12,NA,NA,"Closed Won",NA,NA,"Software",NA,NA,7104,NA,NA,NA,NA,NA,NA,NA,NA,NA,NA,-81.532968,NA,39.287467
NA,"In Faucibus Consulting vtrkAAA  MOL Standard Services","006i0000001vtrkAAA",14,NA,NA,"Closed Lost",NA,NA,"Services",NA,NA,8036,NA,NA,NA,NA,NA,NA,NA,NA,NA,NA,-81.532968,NA,39.287467
NA,"In Faucibus Consulting vu0zAAA  MOL Standard Software","006i0000001vu0zAAA",326,NA,NA,"Closed Won",NA,NA,"Software",NA,NA,255584,NA,NA,NA,NA,NA,NA,NA,NA,NA,NA,-81.532968,NA,39.287467
NA,"In Faucibus Consulting vu1eAAA  MOL Standard Software","006i0000001vu1eAAA",15,NA,NA,"Closed Won",NA,NA,"Software",NA,NA,10800,NA,NA,NA,NA,NA,NA,NA,NA,NA,NA,-81.532968,NA,39.287467
NA,"In Faucibus Consulting vuMcAAI  MOL Standard Software","006i0000001vuMcAAI",22,NA,NA,"Closed Won",NA,NA,"Software",NA,NA,12672,NA,NA,NA,NA,NA,NA,NA,NA,NA,NA,-81.532968,NA,39.287467
NA,"In Faucibus Consulting vuQsAAI  MOL Standard Maintenance","006i0000001vuQsAAI",12,NA,NA,"Closed Won",NA,NA,"Maintenance",NA,NA,1339.2,NA,NA,NA,NA,NA,NA,NA,NA,NA,NA,-81.532968,NA,39.287467
NA,"In Faucibus Consulting vuUjAAI  MOL Standard Software","006i0000001vuUjAAI",61,NA,NA,"Closed Lost",NA,NA,"Software",NA,NA,43920,NA,NA,NA,NA,NA,NA,NA,NA,NA,NA,-81.532968,NA,39.287467
NA,"In Faucibus Consulting vujLAAQ  MOL Premium Software","006i0000001vujLAAQ",138,NA,NA,"Closed Won",NA,NA,"Software",NA,NA,157320,NA,NA,NA,NA,NA,NA,NA,NA,NA,NA,-81.532968,NA,39.287467
NA,"In Faucibus Consulting vumGAAQ  MOL Standard Services","006i0000001vumGAAQ",1,NA,NA,"Closed Lost",NA,NA,"Services",NA,NA,658,NA,NA,NA,NA,NA,NA,NA,NA,NA,NA,-81.532968,NA,39.287467
NA,"In Faucibus Consulting vupYAAQ  MOL Standard Services","006i0000001vupYAAQ",16,NA,NA,"Closed Lost",NA,NA,"Services",NA,NA,8624,NA,NA,NA,NA,NA,NA,NA,NA,NA,NA,-81.532968,NA,39.287467
NA,"In Faucibus Consulting vupZAAQ  MOL Standard Software","006i0000001vupZAAQ",83,NA,NA,"Closed Won",NA,NA,"Software",NA,NA,57768,NA,NA,NA,NA,NA,NA,NA,NA,NA,NA,-81.532968,NA,39.287467
NA,"In Faucibus Consulting vuxjAAA  MOL Standard Software","006i0000001vuxjAAA",4,NA,NA,"Closed Lost",NA,NA,"Software",NA,NA,2336,NA,NA,NA,NA,NA,NA,NA,NA,NA,NA,-81.532968,NA,39.287467
NA,"In Faucibus Consulting vv2LAAQ  MOL Standard Services","006i0000001vv2LAAQ",85,NA,NA,"Closed Won",NA,NA,"Services",NA,NA,58310,NA,NA,NA,NA,NA,NA,NA,NA,NA,NA,-81.532968,NA,39.287467
NA,"In Faucibus Consulting vv3yAAA  MOL Standard Software","006i0000001vv3yAAA",2,NA,NA,"Closed Won",NA,NA,"Software",NA,NA,1520,NA,NA,NA,NA,NA,NA,NA,NA,NA,NA,-81.532968,NA,39.287467
NA,"In Faucibus Consulting vv5CAAQ  MOL Standard Services","006i0000001vv5CAAQ",9,NA,NA,"Closed Won",NA,NA,"Services",NA,NA,5418,NA,NA,NA,NA,NA,NA,NA,NA,NA,NA,-81.532968,NA,39.287467
NA,"In Faucibus Consulting vv5VAAQ  MOL Standard Maintenance","006i0000001vv5VAAQ",17,NA,NA,"Closed Won",NA,NA,"Maintenance",NA,NA,1448.4,NA,NA,NA,NA,NA,NA,NA,NA,NA,NA,-81.532968,NA,39.287467
NA,"In Faucibus Consulting vvC0AAI  MOL Standard Services","006i0000001vvC0AAI",1,NA,NA,"Closed Lost",NA,NA,"Services",NA,NA,539,NA,NA,NA,NA,NA,NA,NA,NA,NA,NA,-81.532968,NA,39.287467
NA,"In Faucibus Consulting vy5tAAA  MOL Standard Software","006i0000001vy5tAAA",46,NA,NA,"Closed Lost",NA,NA,"Software",NA,NA,29072,NA,NA,NA,NA,NA,NA,NA,NA,NA,NA,-81.532968,NA,39.287467
NA,"In Faucibus Consulting vvlyAAA  MOL Premium Software","006i0000001vvlyAAA",4,NA,NA,"Closed Won",NA,NA,"Software",NA,NA,3936,NA,NA,NA,NA,NA,NA,NA,NA,NA,NA,-81.532968,NA,39.287467
NA,"In Faucibus Consulting vvnjAAA  MOL Standard Software","006i0000001vvnjAAA",4,NA,NA,"Closed Lost",NA,NA,"Software",NA,NA,2528,NA,NA,NA,NA,NA,NA,NA,NA,NA,NA,-81.532968,NA,39.287467
NA,"In Faucibus Consulting vvp3AAA  MOL Standard Software","006i0000001vvp3AAA",40,NA,NA,"Closed Lost",NA,NA,"Software",NA,NA,24640,NA,NA,NA,NA,NA,NA,NA,NA,NA,NA,-81.532968,NA,39.287467
NA,"In Faucibus Consulting vvroAAA  MOL Premium Software","006i0000001vvroAAA",2,NA,NA,"Closed Lost",NA,NA,"Software",NA,NA,1848,NA,NA,NA,NA,NA,NA,NA,NA,NA,NA,-81.532968,NA,39.287467
NA,"In Faucibus Consulting vw18AAA  MOL Standard Software","006i0000001vw18AAA",9,NA,NA,"Closed Lost",NA,NA,"Software",NA,NA,5040,NA,NA,NA,NA,NA,NA,NA,NA,NA,NA,-81.532968,NA,39.287467
NA,"In Faucibus Consulting vwFFAAY  MOL Premium Maintenance","006i0000001vwFFAAY",8,NA,NA,"Closed Won",NA,NA,"Maintenance",NA,NA,1080,NA,NA,NA,NA,NA,NA,NA,NA,NA,NA,-81.532968,NA,39.287467
NA,"In Faucibus Consulting vwGGAAY  MOL Standard Services","006i0000001vwGGAAY",2,NA,NA,"Closed Lost",NA,NA,"Services",NA,NA,1204,NA,NA,NA,NA,NA,NA,NA,NA,NA,NA,-81.532968,NA,39.287467
NA,"In Faucibus Consulting vwKcAAI  MOL Standard Services","006i0000001vwKcAAI",1,NA,NA,"Solution",NA,NA,"Services",NA,NA,504,NA,NA,NA,NA,NA,NA,NA,NA,NA,NA,-81.532968,NA,39.287467
NA,"In Faucibus Consulting vwSgAAI  MOL Standard Software","006i0000001vwSgAAI",3,NA,NA,"Closed Won",NA,NA,"Services",NA,NA,2250,NA,NA,NA,NA,NA,NA,NA,NA,NA,NA,-81.532968,NA,39.287467
NA,"In Faucibus Consulting vwXmAAI  MOL Standard Services","006i0000001vwXmAAI",10,NA,NA,"Closed Won",NA,NA,"Services",NA,NA,5040,NA,NA,NA,NA,NA,NA,NA,NA,NA,NA,-81.532968,NA,39.287467
NA,"In Faucibus Consulting vwlkAAA  MOL Standard Maintenance","006i0000001vwlkAAA",19,NA,NA,"Closed Won",NA,NA,"Maintenance",NA,NA,1778.4,NA,NA,NA,NA,NA,NA,NA,NA,NA,NA,-81.532968,NA,39.287467
NA,"In Faucibus Consulting vwnGAAQ  MOL Standard Software","006i0000001vwnGAAQ",2,NA,NA,"Closed Won",NA,NA,"Software",NA,NA,1424,NA,NA,NA,NA,NA,NA,NA,NA,NA,NA,-81.532968,NA,39.287467
NA,"In Faucibus Consulting vwrKAAQ  MOL Standard Services","006i0000001vwrKAAQ",6,NA,NA,"Closed Won",NA,NA,"Services",NA,NA,3780,NA,NA,NA,NA,NA,NA,NA,NA,NA,NA,-81.532968,NA,39.287467
NA,"In Faucibus Consulting vy6hAAA  MOL Standard Software","006i0000001vy6hAAA",206,NA,NA,"Closed Won",NA,NA,"Software",NA,NA,158208,NA,NA,NA,NA,NA,NA,NA,NA,NA,NA,-81.532968,NA,39.287467
NA,"Tellus Eu Augue Incorporated vtVlAAI  MOL Standard Software","006i0000001vtVlAAI",25,NA,NA,"Closed Won",NA,NA,"Software",NA,NA,18200,NA,NA,NA,NA,NA,NA,NA,NA,NA,NA,-76.729335,NA,39.962904
NA,"Tellus Eu Augue Incorporated vtfCAAQ  MOL Standard Software","006i0000001vtfCAAQ",17,NA,NA,"Closed Won",NA,NA,"Software",NA,NA,11696,NA,NA,NA,NA,NA,NA,NA,NA,NA,NA,-76.729335,NA,39.962904
NA,"Tellus Eu Augue Incorporated vtqIAAQ  MOL Standard Software","006i0000001vtqIAAQ",28,NA,NA,"Closed Won",NA,NA,"Software",NA,NA,21280,NA,NA,NA,NA,NA,NA,NA,NA,NA,NA,-76.729335,NA,39.962904
NA,"Tellus Eu Augue Incorporated vuAMAAY  MOL Standard Services","006i0000001vuAMAAY",23,NA,NA,"Closed Won",NA,NA,"Services",NA,NA,15939,NA,NA,NA,NA,NA,NA,NA,NA,NA,NA,-76.729335,NA,39.962904
NA,"Tellus Eu Augue Incorporated vuGQAAY  MOL Premium Maintenance","006i0000001vuGQAAY",3,NA,NA,"Closed Lost",NA,NA,"Maintenance",NA,NA,409.5,NA,NA,NA,NA,NA,NA,NA,NA,NA,NA,-76.729335,NA,39.962904
NA,"Tellus Eu Augue Incorporated vuIyAAI  MOL Standard Services","006i0000001vuIyAAI",1,NA,NA,"Closed Lost",NA,NA,"Services",NA,NA,672,NA,NA,NA,NA,NA,NA,NA,NA,NA,NA,-76.729335,NA,39.962904
NA,"Tellus Eu Augue Incorporated vuLiAAI  MOL Standard Software","006i0000001vuLiAAI",32,NA,NA,"Closed Won",NA,NA,"Software",NA,NA,22016,NA,NA,NA,NA,NA,NA,NA,NA,NA,NA,-76.729335,NA,39.962904
NA,"Tellus Eu Augue Incorporated vuNnAAI  MOL Standard Software","006i0000001vuNnAAI",40,NA,NA,"Closed Won",NA,NA,"Software",NA,NA,27520,NA,NA,NA,NA,NA,NA,NA,NA,NA,NA,-76.729335,NA,39.962904
NA,"Tellus Eu Augue Incorporated vuRMAAY  MOL Standard Maintenance","006i0000001vuRMAAY",9,NA,NA,"Closed Won",NA,NA,"Maintenance",NA,NA,928.8,NA,NA,NA,NA,NA,NA,NA,NA,NA,NA,-76.729335,NA,39.962904
NA,"Tellus Eu Augue Incorporated vuYUAAY  MOL Standard Software","006i0000001vuYUAAY",48,NA,NA,"Closed Lost",NA,NA,"Software",NA,NA,33024,NA,NA,NA,NA,NA,NA,NA,NA,NA,NA,-76.729335,NA,39.962904
NA,"Tellus Eu Augue Incorporated vuZDAAY  MOL Standard Software","006i0000001vuZDAAY",534,NA,NA,"Closed Lost",NA,NA,"Software",NA,NA,316128,NA,NA,NA,NA,NA,NA,NA,NA,NA,NA,-76.729335,NA,39.962904
NA,"Tellus Eu Augue Incorporated vuZCAAY  MOL Standard Software","006i0000001vuZCAAY",34,NA,NA,"Closed Lost",NA,NA,"Software",NA,NA,20672,NA,NA,NA,NA,NA,NA,NA,NA,NA,NA,-76.729335,NA,39.962904
NA,"Tellus Eu Augue Incorporated vvHGAAY  MOL Standard Software","006i0000001vvHGAAY",23,NA,NA,"Closed Won",NA,NA,"Software",NA,NA,13800,NA,NA,NA,NA,NA,NA,NA,NA,NA,NA,-76.729335,NA,39.962904
NA,"Tellus Eu Augue Incorporated vvUVAAY  MOL Standard Services","006i0000001vvUVAAY",1,NA,NA,"Closed Lost",NA,NA,"Services",NA,NA,546,NA,NA,NA,NA,NA,NA,NA,NA,NA,NA,-76.729335,NA,39.962904
NA,"Tellus Eu Augue Incorporated vvd2AAA  MOL Standard Software","006i0000001vvd2AAA",2,NA,NA,"Closed Lost",NA,NA,"Software",NA,NA,1200,NA,NA,NA,NA,NA,NA,NA,NA,NA,NA,-76.729335,NA,39.962904
NA,"Tellus Eu Augue Incorporated vvcQAAQ  MOL Premium Software","006i0000001vvcQAAQ",13,NA,NA,"Closed Won",NA,NA,"Software",NA,NA,11076,NA,NA,NA,NA,NA,NA,NA,NA,NA,NA,-76.729335,NA,39.962904
NA,"Tellus Eu Augue Incorporated vvd1AAA  MOL Premium Software","006i0000001vvd1AAA",7,NA,NA,"Closed Won",NA,NA,"Software",NA,NA,7728,NA,NA,NA,NA,NA,NA,NA,NA,NA,NA,-76.729335,NA,39.962904
NA,"Tellus Eu Augue Incorporated vviiAAA  MOL Premium Software","006i0000001vviiAAA",1,NA,NA,"Closed Lost",NA,NA,"Software",NA,NA,960,NA,NA,NA,NA,NA,NA,NA,NA,NA,NA,-76.729335,NA,39.962904
NA,"Tellus Eu Augue Incorporated vvmJAAQ  MOL Standard Software","006i0000001vvmJAAQ",12,NA,NA,"Closed Won",NA,NA,"Software",NA,NA,9312,NA,NA,NA,NA,NA,NA,NA,NA,NA,NA,-76.729335,NA,39.962904
NA,"Tellus Eu Augue Incorporated vvnIAAQ  MOL Standard Software","006i0000001vvnIAAQ",48,NA,NA,"Closed Won",NA,NA,"Software",NA,NA,28416,NA,NA,NA,NA,NA,NA,NA,NA,NA,NA,-76.729335,NA,39.962904
NA,"Tellus Eu Augue Incorporated vvnVAAQ  MOL Standard Maintenance","006i0000001vvnVAAQ",3,NA,NA,"Closed Lost",NA,NA,"Maintenance",NA,NA,334.8,NA,NA,NA,NA,NA,NA,NA,NA,NA,NA,-76.729335,NA,39.962904
NA,"Tellus Eu Augue Incorporated vvslAAA  MOL Standard Software","006i0000001vvslAAA",30,NA,NA,"Closed Won",NA,NA,"Software",NA,NA,17520,NA,NA,NA,NA,NA,NA,NA,NA,NA,NA,-76.729335,NA,39.962904
NA,"Tellus Eu Augue Incorporated vwM9AAI  MOL Standard Services","006i0000001vwM9AAI",987,NA,NA,"Closed Won",NA,NA,"Services",NA,NA,663264,NA,NA,NA,NA,NA,NA,NA,NA,NA,NA,-76.729335,NA,39.962904
NA,"Tellus Eu Augue Incorporated vwaVAAQ  MOL Standard Services","006i0000001vwaVAAQ",17,NA,NA,"Closed Lost",NA,NA,"Services",NA,NA,10591,NA,NA,NA,NA,NA,NA,NA,NA,NA,NA,-76.729335,NA,39.962904
NA,"Tellus Eu Augue Incorporated vwhHAAQ  MOL Standard Software","006i0000001vwhHAAQ",13,NA,NA,"Closed Lost",NA,NA,"Software",NA,NA,8112,NA,NA,NA,NA,NA,NA,NA,NA,NA,NA,-76.729335,NA,39.962904
NA,"Tellus Eu Augue Incorporated vwppAAA  MOL Standard Software","006i0000001vwppAAA",15,NA,NA,"Closed Won",NA,NA,"Software",NA,NA,10920,NA,NA,NA,NA,NA,NA,NA,NA,NA,NA,-76.729335,NA,39.962904
NA,"Tellus Eu Augue Incorporated vx1RAAQ  MOL Standard Software","006i0000001vx1RAAQ",8,NA,NA,"Closed Won",NA,NA,"Software",NA,NA,6144,NA,NA,NA,NA,NA,NA,NA,NA,NA,NA,-76.729335,NA,39.962904
NA,"Tellus Eu Augue Incorporated vx4BAAQ  MOL Standard Software","006i0000001vx4BAAQ",201,NA,NA,"Closed Lost",NA,NA,"Software",NA,NA,127032,NA,NA,NA,NA,NA,NA,NA,NA,NA,NA,-76.729335,NA,39.962904
NA,"Tellus Eu Augue Incorporated vxYuAAI  MOL Standard Software","006i0000001vxYuAAI",3,NA,NA,"Closed Lost",NA,NA,"Software",NA,NA,2376,NA,NA,NA,NA,NA,NA,NA,NA,NA,NA,-76.729335,NA,39.962904
NA,"Tellus Eu Augue Incorporated vxkWAAQ  MOL Standard Software","006i0000001vxkWAAQ",24,NA,NA,"Closed Lost",NA,NA,"Software",NA,NA,14016,NA,NA,NA,NA,NA,NA,NA,NA,NA,NA,-76.729335,NA,39.962904
NA,"Tellus Eu Augue Incorporated vxnRAAQ  MOL Standard Software","006i0000001vxnRAAQ",4,NA,NA,"Closed Lost",NA,NA,"Software",NA,NA,2592,NA,NA,NA,NA,NA,NA,NA,NA,NA,NA,-76.729335,NA,39.962904
NA,"Tellus Eu Augue Incorporated vxqlAAA  MOL Standard Software","006i0000001vxqlAAA",152,NA,NA,"Commit",NA,NA,"Software",NA,NA,116736,NA,NA,NA,NA,NA,NA,NA,NA,NA,NA,-76.729335,NA,39.962904
NA,"Ut Nulla Industries vtYJAAY  MOL Standard Software","006i0000001vtYJAAY",4,NA,NA,"Closed Won",NA,NA,"Maintenance",NA,NA,379.2,NA,NA,NA,NA,NA,NA,NA,NA,NA,NA,-75.293793,NA,40.00866
NA,"Ut Nulla Industries vu5AAAQ  MOL Mobile Software","006i0000001vu5AAAQ",15,NA,NA,"Closed Lost",NA,NA,"Software",NA,NA,12285,NA,NA,NA,NA,NA,NA,NA,NA,NA,NA,-75.293793,NA,40.00866
NA,"Ut Nulla Industries vuEeAAI  MOL Premium Software","006i0000001vuEeAAI",18,NA,NA,"Closed Won",NA,NA,"Software",NA,NA,18792,NA,NA,NA,NA,NA,NA,NA,NA,NA,NA,-75.293793,NA,40.00866
NA,"Ut Nulla Industries vwGXAAY  MOL Standard Software","006i0000001vwGXAAY",45,NA,NA,"Closed Won",NA,NA,"Software",NA,NA,28800,NA,NA,NA,NA,NA,NA,NA,NA,NA,NA,-75.293793,NA,40.00866
NA,"Ut Nulla Industries vxLjAAI  MOL Standard Maintenance","006i0000001vxLjAAI",3,NA,NA,"Closed Lost",NA,NA,"Maintenance",NA,NA,259.2,NA,NA,NA,NA,NA,NA,NA,NA,NA,NA,-75.293793,NA,40.00866
NA,"Ut Nulla Industries vxQqAAI  MOL Standard Software","006i0000001vxQqAAI",86,NA,NA,"Closed Lost",NA,NA,"Software",NA,NA,67424,NA,NA,NA,NA,NA,NA,NA,NA,NA,NA,-75.293793,NA,40.00866
NA,"Diam Industries vtxUAAQ  MOL Standard Maintenance","006i0000001vtxUAAQ",31,NA,NA,"Closed Won",NA,NA,"Maintenance",NA,NA,2678.4,NA,NA,NA,NA,NA,NA,NA,NA,NA,NA,-83.918128,NA,35.965693
NA,"Diam Industries vu33AAA  MOL Standard Services","006i0000001vu33AAA",20,NA,NA,"Closed Won",NA,NA,"Services",NA,NA,10920,NA,NA,NA,NA,NA,NA,NA,NA,NA,NA,-83.918128,NA,35.965693
NA,"Diam Industries vu5XAAQ  MOL Standard Services","006i0000001vu5XAAQ",149,NA,NA,"Closed Lost",NA,NA,"Services",NA,NA,101171,NA,NA,NA,NA,NA,NA,NA,NA,NA,NA,-83.918128,NA,35.965693
NA,"Diam Industries vu8mAAA  MOL Standard Services","006i0000001vu8mAAA",23,NA,NA,"Closed Lost",NA,NA,"Services",NA,NA,14812,NA,NA,NA,NA,NA,NA,NA,NA,NA,NA,-83.918128,NA,35.965693
NA,"Diam Industries vv7cAAA  MOL Premium Software","006i0000001vv7cAAA",2,NA,NA,"Closed Won",NA,NA,"Software",NA,NA,1896,NA,NA,NA,NA,NA,NA,NA,NA,NA,NA,-83.918128,NA,35.965693
NA,"Diam Industries vw4pAAA  MOL Standard Maintenance","006i0000001vw4pAAA",8,NA,NA,"Closed Lost",NA,NA,"Maintenance",NA,NA,729.6,NA,NA,NA,NA,NA,NA,NA,NA,NA,NA,-83.918128,NA,35.965693
NA,"Diam Industries vwAUAAY  MOL Standard Maintenance","006i0000001vwAUAAY",13,NA,NA,"Closed Won",NA,NA,"Maintenance",NA,NA,1107.6,NA,NA,NA,NA,NA,NA,NA,NA,NA,NA,-83.918128,NA,35.965693
NA,"Diam Industries vwczAAA  MOL Premium Software","006i0000001vwczAAA",3,NA,NA,"Closed Lost",NA,NA,"Software",NA,NA,2664,NA,NA,NA,NA,NA,NA,NA,NA,NA,NA,-83.918128,NA,35.965693
NA,"Diam Industries vxRIAAY  MOL Standard Services","006i0000001vxRIAAY",1,NA,NA,"Closed Won",NA,NA,"Services",NA,NA,609,NA,NA,NA,NA,NA,NA,NA,NA,NA,NA,-83.918128,NA,35.965693
NA,"Elux India vtJFAAY  MOL Standard Software","006i0000001vtJFAAY",30,NA,NA,"Closed Lost",NA,NA,"Software",NA,NA,21840,NA,NA,NA,NA,NA,NA,NA,NA,NA,NA,-68.769833,NA,44.796792
NA,"Elux India vtg7AAA  MOL Standard Software","006i0000001vtg7AAA",144,NA,NA,"Closed Won",NA,NA,"Software",NA,NA,107136,NA,NA,NA,NA,NA,NA,NA,NA,NA,NA,-68.769833,NA,44.796792
NA,"Elux India vuZLAAY  MOL Standard Services","006i0000001vuZLAAY",1,NA,NA,"Closed Lost",NA,NA,"Services",NA,NA,623,NA,NA,NA,NA,NA,NA,NA,NA,NA,NA,-68.769833,NA,44.796792
NA,"Elux India vuY8AAI  MOL Standard Software","006i0000001vuY8AAI",4,NA,NA,"Closed Lost",NA,NA,"Software",NA,NA,2368,NA,NA,NA,NA,NA,NA,NA,NA,NA,NA,-68.769833,NA,44.796792
NA,"Elux India vwIRAAY  MOL Standard Software","006i0000001vwIRAAY",26,NA,NA,"Closed Won",NA,NA,"Software",NA,NA,19344,NA,NA,NA,NA,NA,NA,NA,NA,NA,NA,-68.769833,NA,44.796792
NA,"Elux India vx4JAAQ  MOL Standard Software","006i0000001vx4JAAQ",367,NA,NA,"Closed Won",NA,NA,"Software",NA,NA,214328,NA,NA,NA,NA,NA,NA,NA,NA,NA,NA,-68.769833,NA,44.796792
NA,"Elux India vxr8AAA  MOL Mobile Software","006i0000001vxr8AAA",20,NA,NA,"Commit",NA,NA,"Software",NA,NA,14580,NA,NA,NA,NA,NA,NA,NA,NA,NA,NA,-68.769833,NA,44.796792
NA,"Nulla Magna Institute vvpGAAQ  MOL Standard Software","006i0000001vvpGAAQ",3,NA,NA,"Closed Won",NA,NA,"Software",NA,NA,1944,NA,NA,NA,NA,NA,NA,NA,NA,NA,NA,-103.336341,NA,34.185863
NA,"Nulla Magna Institute vxrfAAA  MOL Standard Software","006i0000001vxrfAAA",27,NA,NA,"Discover",NA,NA,"Software",NA,NA,20736,NA,NA,NA,NA,NA,NA,NA,NA,NA,NA,-103.336341,NA,34.185863
NA,"Consectetuer Euismod Incorporated vthvAAA  MOL Standard Services","006i0000001vthvAAA",67,NA,NA,"Closed Won",NA,NA,"Services",NA,NA,40334,NA,NA,NA,NA,NA,NA,NA,NA,NA,NA,-78.646386,NA,35.782584
NA,"Consectetuer Euismod Incorporated vuNBAAY  MOL Standard Maintenance","006i0000001vuNBAAY",17,NA,NA,"Closed Won",NA,NA,"Maintenance",NA,NA,1734,NA,NA,NA,NA,NA,NA,NA,NA,NA,NA,-78.646386,NA,35.782584
NA,"Consectetuer Euismod Incorporated vvJ3AAI  MOL Standard Services","006i0000001vvJ3AAI",2,NA,NA,"Closed Won",NA,NA,"Services",NA,NA,1106,NA,NA,NA,NA,NA,NA,NA,NA,NA,NA,-78.646386,NA,35.782584
NA,"Consectetuer Euismod Incorporated vvi8AAA  MOL Premium Software","006i0000001vvi8AAA",9,NA,NA,"Closed Won",NA,NA,"Software",NA,NA,9612,NA,NA,NA,NA,NA,NA,NA,NA,NA,NA,-78.646386,NA,35.782584
NA,"Consectetuer Euismod Incorporated vvpfAAA  MOL Mobile Software","006i0000001vvpfAAA",2,NA,NA,"Closed Won",NA,NA,"Software",NA,NA,1314,NA,NA,NA,NA,NA,NA,NA,NA,NA,NA,-78.646386,NA,35.782584
NA,"Consectetuer Euismod Incorporated vxh9AAA  MOL Premium Services","006i0000001vxh9AAA",3,NA,NA,"Closed Lost",NA,NA,"Services",NA,NA,2940,NA,NA,NA,NA,NA,NA,NA,NA,NA,NA,-78.646386,NA,35.782584
